{
  "candidates_version": "1.0.0",
  "claims": [
    {
      "as_of": "2026-09-03T23:45:00+08:00",
      "claim_id": "claim-gzsz-moca-window",
      "confidence": 0.65,
      "field_path": "/opening_windows/0",
      "json_path": null,
      "mode": "static",
      "provider": "official-web",
      "queried_at": "2026-09-03T23:45:00+08:00",
      "raw_ref": null,
      "response_hash": null,
      "source_url": "https://zjj.sz.gov.cn/gkmlpt/content/12/12270/post_12270322.html",
      "status": "hypothesis",
      "subject_ref": "poi-gzsz-moca",
      "value": "深圳市住建局页面确认深圳市当代艺术与城市规划馆为公共文化地标；09:30-11:00 仅为规划窗，未来开放需复核"
    },
    {
      "as_of": "2026-09-03T23:45:00+08:00",
      "claim_id": "claim-gzsz-lianhua-window",
      "confidence": 0.85,
      "field_path": "/opening_windows/0",
      "json_path": null,
      "mode": "static",
      "provider": "official-web",
      "queried_at": "2026-09-03T23:45:00+08:00",
      "raw_ref": null,
      "response_hash": null,
      "source_url": "https://cgj.sz.gov.cn/xsmh/gysz/twf/etly/content/post_10841730.html",
      "status": "partial",
      "subject_ref": "poi-gzsz-lianhua",
      "value": "深圳市城管局页面列明莲花山公园常规开放 06:00-23:00、22:30 停止入园；未来日期临时管控仍需复核"
    },
    {
      "as_of": "2026-09-03T23:45:00+08:00",
      "claim_id": "claim-gzsz-bookcity-window",
      "confidence": 0.6,
      "field_path": "/opening_windows/0",
      "json_path": null,
      "mode": "static",
      "provider": "official-web",
      "queried_at": "2026-09-03T23:45:00+08:00",
      "raw_ref": null,
      "response_hash": null,
      "source_url": "https://zjj.sz.gov.cn/gkmlpt/content/12/12270/post_12270322.html",
      "status": "hypothesis",
      "subject_ref": "poi-gzsz-bookcity",
      "value": "深圳市住建局页面确认深圳书城中心城位于福田中心区公共文化建筑群；13:30-15:00 仅为规划窗"
    }
  ],
  "lodgings": [],
  "pois": [
    {
      "category": "museum",
      "city": "深圳",
      "claim_ids": [
        "claim-gzsz-moca-window"
      ],
      "coordinates": null,
      "deep_links": [
        "https://zjj.sz.gov.cn/gkmlpt/content/12/12270/post_12270322.html"
      ],
      "name": "深圳市当代艺术与城市规划馆",
      "opening_windows": [
        {
          "claim_id": "claim-gzsz-moca-window",
          "end_at": "2026-09-10T11:00:00+08:00",
          "start_at": "2026-09-10T09:30:00+08:00",
          "status": "tentative"
        }
      ],
      "poi_id": "poi-gzsz-moca",
      "price": null,
      "recommended_duration_minutes": 60
    },
    {
      "category": "park",
      "city": "深圳",
      "claim_ids": [
        "claim-gzsz-lianhua-window"
      ],
      "coordinates": null,
      "deep_links": [
        "https://cgj.sz.gov.cn/xsmh/gysz/twf/etly/content/post_10841730.html"
      ],
      "name": "莲花山公园",
      "opening_windows": [
        {
          "claim_id": "claim-gzsz-lianhua-window",
          "end_at": "2026-09-10T12:30:00+08:00",
          "start_at": "2026-09-10T11:15:00+08:00",
          "status": "tentative"
        }
      ],
      "poi_id": "poi-gzsz-lianhua",
      "price": null,
      "recommended_duration_minutes": 60
    },
    {
      "category": "architecture",
      "city": "深圳",
      "claim_ids": [
        "claim-gzsz-bookcity-window"
      ],
      "coordinates": null,
      "deep_links": [
        "https://zjj.sz.gov.cn/gkmlpt/content/12/12270/post_12270322.html"
      ],
      "name": "深圳书城中心城",
      "opening_windows": [
        {
          "claim_id": "claim-gzsz-bookcity-window",
          "end_at": "2026-09-10T15:00:00+08:00",
          "start_at": "2026-09-10T13:30:00+08:00",
          "status": "tentative"
        }
      ],
      "poi_id": "poi-gzsz-bookcity",
      "price": null,
      "recommended_duration_minutes": 60
    }
  ],
  "unknowns": [
    {
      "claim_id": "claim-gzsz-moca-window",
      "field_path": "/pois/0/coordinates",
      "provider": "amap",
      "reason": "live AMap geocode is deferred to plan execution"
    },
    {
      "claim_id": "claim-gzsz-lianhua-window",
      "field_path": "/pois/1/coordinates",
      "provider": "amap",
      "reason": "live AMap geocode is deferred to plan execution"
    },
    {
      "claim_id": "claim-gzsz-bookcity-window",
      "field_path": "/pois/2/coordinates",
      "provider": "amap",
      "reason": "live AMap geocode is deferred to plan execution"
    }
  ]
}
